,Press,Url,Title,Date,Body,Weekday,Sentiment
79,한국경제,https://n.news.naver.com/mnews/article/015/0004887488,대검 차장에 심우정 임명…중앙지검장·검찰국장 유임,2023-09-05,"검찰 고위직 40명 인사반부패수사부장 양석조공공수사부장에 박기동심우정 대검차장법무부가 대검찰청 검사급 간부 인사를 단행했다. 작년에 영전한 간부들이 핵심 요직을 유지하거나 주요 수사 지휘 라인에 전진 배치됐다. ‘윤석열 사단’으로 불리는 특수통이 영전하는 흐름이 이어졌다는 분석이다.법무부는 4일 대검 검사급(고검장·검사장) 40명의 인사를 오는 7일자로 단행했다. 가장 관심을 끈 서울중앙지방검찰청장은 송경호 검사장(사법연수원 29기)이 유임됐다. 경기 성남시 백현동 개발비리와 더불어민주당 돈봉투 의혹 등 굵직한 사건의 수사를 차질 없이 이어가겠다는 의지로 풀이된다. 신자용 법무부 검찰국장(28기)도 유임됐다.양석조 반부패부장검찰 특수수사를 이끄는 대검 반부패수사부장에는 양석조 서울남부지검장(29기)이 보임됐다. 내년 총선을 앞두고 선거 사건을 진두지휘할 대검 공공수사부장에는 박기동 서울중앙지검 3차장(30기)이 검사장으로 승진했다. 대검 살림살이를 총괄하는 기획조정부장에는 성상헌 서울중앙지검 1차장(30기)이 낙점됐다. 모두 작년 검찰 인사 때 핵심 자리로 이동한 인물이다.이원석 검찰총장 취임 후 약 1년간 공석이던 대검 차장검사에는 심우정 인천지검장(26기)이 고검장으로 승진해 보임됐다. 형사부장은 박세현 서울고검 형사부장(29기), 마약·조직범죄부장은 박영빈 인천지검 1차장(30기), 공판송무부장은 정유미 천안지청장(30기), 과학수사부장은 박현준 창원지검 차장(30기)이 임명됐다.다른 주요 일선청 수장도 작년 영전한 인물들이 중용됐다. 신봉수 대검 반부패수사부장(29기)은 검사장으로 승진해 수원지검장을 맡는다. 이재명 민주당 대표의 대북 송금 의혹 등을 지휘할 예정이다. 김유철 대검 공공수사부장(29기)도 승진해 서울남부지검장에 임명됐다. 구상엽 서울남부지검 1차장(30기)은 법무부 법무실장으로 승진 보임한다.황병주 대검 형사부장(29기)은 서울동부지검장, 김선화 공판송무부장은 의정부지검장(30기), 송강 기획조정부장(29기)은 인천지검장, 정진우 과학수사부장(29기)은 춘천지검장, 박재억 마약·조직범죄부장(29기)은 대전지검장으로 자리를 옮겼다.▶관련인사 A28면 ",화,
80,한국경제,https://n.news.naver.com/mnews/article/015/0004887489,'전공노 탈퇴' 원주시 노조 2심도 승소,2023-09-05,"법원 ""노조 설립신고 없이도민노총 탈퇴할 수 있다"" 판결노동조합 설립 신고 없이도 전국민주노동조합총연맹을 탈퇴할 수 있다는 법원 판결이 나왔다. 민주노총 탈퇴를 추진 중인 다른 노조·지부들의 움직임에도 탄력이 붙을 전망이다.4일 법조계에 따르면 서울고등법원 춘천2민사부는 지난 1일 전국공무원노조가 강원 원주시 공무원노조를 상대로 제기한 총회결의 무효 확인소송 항소심에서 원심대로 원고 패소 판결을 내렸다. 재판부는 “노조로서 실체를 가진 단체들 사이에서 단지 설립 신고 여부에 따라 노동조합법 18조 4항의 적용 여부를 달리 판단하고 차등을 둘 이유가 없다”고 설명했다. 노조법 18조 4항은 노조에 총회 소집권자가 부재한 경우 조합원 3분의 1 이상 요구로 관할 고용노동청이 소집권자를 지명할 수 있다고 규정한다.원주시노조는 전공노 소속 지부로 활동하다가 2021년 8월 24일 조합원 투표를 통해 민주노총 및 전공노 탈퇴를 결의했다. 그러자 전공노는 탈퇴를 주도한 지부 임원들의 권한을 정지하고 제명한 뒤 탈퇴를 무효로 해달라는 취지의 소송을 제기했다. 전공노 측은 “(원주시노조는) 일개 지부에 불과하므로 탈퇴 등 조직 형태 변경 권한이 없다”고 주장했다.지난해 12월 열린 1심에선 원주시노조가 승소했다. 재판부는 “산별노조와 독립해 의사를 결정할 능력을 갖춘 지부는 자주적·민주적 결의를 거쳐 목적 및 조직을 선택하고 변경할 수 있다”고 판시했다. 전공노는 곧바로 항소했다. 2심 진행 과정에선 노조법 18조 4항을 내세워 투표 당시 원주시지부가 정식으로 설립 신고가 안 된 ‘법외노조’라는 점을 문제 삼았다.하지만 이 같은 주장은 받아들여지지 않았다. 항소심 재판부는 “(원주시지부는) 기업별 노조와 비슷한 근로자단체로 일정한 자율성과 독립성을 가지고 있다”며 “설립 신고 여부만 놓고 달리 판단할 이유가 없다”고 설명했다.",화,
81,한국경제,https://n.news.naver.com/mnews/article/015/0004887490,교사 12만명 '추모집회'…학교 혼란은 없었다,2023-09-05,"'공교육 멈춤의 날' 집단 병가·연가…곳곳 단축수업국회앞 서이초 교사 추모 5만명임시휴업 학교 전국 38곳 그쳐학부모, 체험학습 신청 응원도尹 ""교사들 목소리 깊이 새겨야""이주호 ""참석 교원 징계 안할 것""지난 7월 스스로 목숨을 끊은 서이초 교사의 49재인 4일. 서울 여의도 국회의사당 앞에서 대규모 추모제가 열렸다. 전국에서 5만 명(주최 측 추산)의 교사가 모였다. 이날 전국 시·도교육청에서 열린 집회에 참석한 인원까지 고려하면 12만 명 이상의 교원이 거리로 나왔다. 20만 명 넘게 모인 2일 집회보다는 수가 줄었지만 학기가 시작된 평일이라는 점을 고려하면 예상 밖의 인원이 모였다는 평가다. 전국 학교 임시휴업·단축수업·체험학습교육부는 우려하던 학교 현장 혼란은 없다고 강조했다. 교육부에 따르면 이날 임시휴업을 결정한 학교는 38개로 지난 금요일보다 8곳 늘었지만 전국 6286개 학교의 0.05%에 그쳤다.상당수 교사는 연가, 병가를 활용한 것으로 나타났다. 전국 시·도교육청에 따르면 부산에서는 초등교사 가운데 1600여 명, 인천에서는 2000여 명이 연가·병가 등으로 자리를 비운 것으로 추산된다. 이 때문에 상당수 학교가 이날 단축수업을 했다. 서울 방일초의 한 학생은 “6학년 6개 반 중 3개 반 담임선생님이 오지 않았다”며 “우리 반 담임선생님도 오지 않아 옆 반 선생님이 다큐멘터리를 틀어줘서 보다가 하교했다”고 말했다.현장 추모제에 참석한 교사들은 서이초 사건이 49일이나 지났지만 달라진 게 없다고 목소리를 높였다. 사망 원인이 밝혀지지 않았고 대책으로 나온 정부 정책의 실효성이 떨어진다고 지적했다. 교사들이 가장 큰 문제로 보는 것은 ‘정당한 생활지도’라는 규정이었다. 집회에 참석한 한 교사는 “정당한 생활지도, 교육활동이 무엇인지 정확히 규정하지 않는다면 결국 법원에 가서 이를 가려야 한다”며 “지금과 달라지는 것은 하나도 없을 것”이라고 우려했다.아동학대법 문제가 해결되지 않으면 교육부가 최근 발표한 ‘학생 생활지도 고시안’도 유명무실해질 것이라고 지적했다. 인천의 한 교사는 “문제 행동을 반복하면 교실에서 분리할 수 있게 하는 규정이 있지만 이후 아이를 어디로 보낼지, 누가 관리할지 인력, 예산 등에 대한 지원이 전무하다”며 “교실에서 나가라고 하는 과정에서 많은 아이 앞에서 행동을 지적하거나 반복해 나가라고 말하면 아동학대로 신고당할 것”이라고 걱정했다. 징계 여부에 대통령실 “유연성 발휘”유례없는 공교육 멈춤에도 교사에게 지지를 보내는 학부모가 적지 않았다. 갑작스러운 단축수업으로 하교하는 아이를 데리러 온 한 학부모는 “어린 나이에 떠난 선생님을 추모하려는 것인데 충분히 이해가 간다”며 “하루 정도 일찍 끝나는 것은 별것 아니라고 생각한다”고 말했다.선생님을 지지하기 위해 한발 앞서 체험학습을 신청한 사례도 많았다. 국회 앞 추모제에 참석한 한 학부모는 “아이 세 명 모두 체험학습을 신청해 선생님들을 응원하기 위해 이곳에 왔다”고 했다.교육부는 추모제에 참석한 교사들에 대해 징계하지 않겠다는 입장을 밝혔다. 이주호 부총리 겸 교육부 장관은 이날 저녁 국회 예산결산특별위원회 전체회의에서 “추모에 참가한 교사에 대한 징계는 검토하지 않겠다”며 “교사들을 징계할 일은 없을 것”이라고 말했다.앞서 대통령실 역시 교권 보호를 거듭 강조하며 징계 여부에 대해 신중한 모습을 보인 것이 영향을 미쳤다는 분석이 나온다. 윤석열 대통령은 이날 오전 용산 대통령실에서 열린 수석비서관회의에서 “지난 주말 현장 교사들이 외친 목소리를 깊이 새겨 교권 확립과 교육현장 정상화에 만전을 기하라”고 지시했다. 중징계를 예고한 교육부 방침과 배치되는 것 아니냐는 지적이 나오자 대통령실 관계자는 “법은 원칙과 적용 문제로 교육당국이 법에 따른 규정을 준수해달라고 하는 것은 필요하다”면서도 “법 적용에 어느 정도 유연성을 발휘할 수 있다고 본다”고 말했다.",화,
82,한국경제,https://n.news.naver.com/mnews/article/015/0004887480,"1급이상 공직자, 가상자산 형성과정 신고해야",2023-09-05,"재산등록시 1년간 거래내역도앞으로 4급 이상 공직자는 재산등록 시 가상자산 종류와 수량을 구체적으로 신고해야 한다. 1급(준차관급) 이상은 재산등록일 기준 보유한 가상자산이 없더라도 최근 1년간 거래내역과 자산형성 과정까지 신고 대상이 된다.인사혁신처는 4일 이 같은 내용을 담은 ‘공직자윤리법 시행령’ 일부 개정령안을 다음달 16일까지 입법예고하고 12월 14일부터 시행한다고 밝혔다.정부는 매달 임용·퇴직 고위공직자의 재산을 공개하는데 가상자산은 공개 목록에 포함하지 않았다. 그러다 김남국 더불어민주당 의원의 가상자산 보유 논란을 계기로 국회의원과 공직자가 가상자산을 의무적으로 공개하도록 하는 ‘공직자윤리법’이 지난 6월 개정됐다. 법 개정에 따른 후속 조치로 이번에 시행령이 마련됐다.재산등록의무자는 우선 보유한 가상자산 종류와 수량을 등록해야 한다. 업비트, 빗썸, 코인원 등 가상자산 플랫폼에 예치된 자산은 등록기준일의 하루평균가액 평균액으로 신고해야 한다. 외부 지갑 등에 저장된 가상자산은 최종 시세가액으로 신고하되 최종 시세가액을 알 수 없거나 사실상 확인이 불가능할 때는 실거래가액 등 합리적으로 인정되는 가액으로 등록하도록 규정했다.",화,
83,한국경제,https://n.news.naver.com/mnews/article/015/0004887479,'배상윤 황제 도피' 도운 KH임직원 징역 1년 선고,2023-09-05,배상윤 KH그룹 회장의 ‘황제 도피’를 도운 그룹 임직원들이 나란히 1심에서 실형을 선고받았다.4일 장수진 서울중앙지방법원 형사7단독 판사는 범인 도피 등의 혐의로 재판에 넘겨진 KH그룹 총괄부회장 우모씨(54)에게 징역 1년을 선고했다. 같은 혐의로 기소된 수행팀장 이모씨(31)는 징역 1년과 벌금 500만원을 선고받았다.재판부는 “우씨와 이씨는 KH그룹의 물적·인적 자원을 이용해 수사를 방해하고 배 회장의 소재 파악을 어렵게 했다”고 했다. 이어 “우씨가 배 회장에게 송금한 1억여원은 평범한 직장인의 1년 연봉을 웃돈다”며 “배 회장은 도박과 골프를 하며 부족함 없는 삶을 누렸다”고 비판했다.이들은 동남아시아 일대에서 도피 중인 배 회장에게 자금을 전달하는 등 이른바 ‘황제 도피’를 도운 혐의로 지난 6월 구속 기소됐다.,화,
84,한국경제,https://n.news.naver.com/mnews/article/015/0004887484,김포~여의도 30분 만에 도착…'한강 리버버스' 내년 9월 뜬다,2023-09-05,"운항간격 출퇴근 시간대 15분요금은 대중교통 수준 고려 중마포·잠실 등 연결노선도 검토최대 200명을 태우고 경기 김포에서 서울 여의도까지 30분 만에 도착하는 수상버스(리버버스·사진)가 이르면 내년 9월 도입된다.오세훈 서울시장과 최종양 이랜드그룹 부회장은 4일 서울시청에서 통근·관광용 리버버스 운영을 위한 ‘한강 리버버스 사업 추진 공동협력 협약’을 맺었다. 리버버스 운행사업을 맡은 이랜드그룹 계열사 이크루즈는 30년 이상 선박을 운항해온 업체다. 지난 7월 리버버스 사업자 선정을 위한 민간공모에 우선협상대상자로 선정됐다. 이크루즈는 199인승 친환경 선박을 내년 하반기께 도입하고 서울시는 선착장 유지, 둔치 접근을 위한 시설 조성 등 행정적 지원을 한다.김포 아라뱃길과 한강 사이 물 수위를 조절하는 서울 개화동 아라한강갑문에서 여의도 선착장을 오가는 노선이 현재로선 유력하다. 최대 시속 50㎞ 속도로 해당 노선을 30분 만에 주파할 수 있다고 시는 설명했다. 운항 간격은 출퇴근 시간대 15분으로 유지한다는 방침이다. 요금은 정해지지 않았다. 시 관계자는 “광역버스(3000원) 등 다른 육상 대중교통 수단의 이용요금 수준을 고려하고 있다”고 말했다.서울시는 아라한강갑문~여의도 외 노선도 추진할 계획이다. 마포 여의도 잠원 잠실 등 주요 주거지역, 업무지역, 관광지역을 연결하는 복수의 시내 노선을 염두에 두고 있다.전문가들은 리버버스 안착을 위해서는 서울시가 과거 추진했던 수상택시를 반면교사로 삼아야 한다고 지적한다. 오 시장 첫 임기 때인 2007년 10월, 하루 2만 명 수요를 예상하며 수상택시 운항을 시작했지만 하루평균 이용객 100명 수준에 그쳤다. 둔치와 주요 도로가 연결돼 있지 않은 데다 1인 5000원으로 다소 부담스러운 요금이 사업 실패 원인으로 꼽혔다. 출퇴근용 승객은 2020년 32명, 2021년 10명 이하에 그쳤다. 2021년 사업은 사실상 폐지됐다.리버버스가 수상택시 전철을 밟지 않으려면 다른 대중교통과의 연계성을 높이는 게 관건이다. 오 시장 역시 “한강은 시민들이 즐겁게 이용하고 있지만 연계성이 늘 고민이었다”고 했다. 시는 선착장으로 접근하는 시내버스 노선을 신설하고 둔치 인근 도로를 정비할 방침이다. 자전거 등 개인 이동수단 등을 지니고 탑승하는 것도 허용할 계획이다.서울시 한강사업본부 관계자는 “과거에는 8·12인승 등 소규모 택시였지만 지금 추진되는 것은 최대 200명이 탈 수 있는 페리 개념”이라며 “수요도 더 많고 경제성도 있을 것”이라고 설명했다.",화,
85,한국경제,https://n.news.naver.com/mnews/article/015/0004887449,"어딘가 불쾌한데, 이토록 경이롭다니…",2023-09-05,"국제갤러리 아니쉬 카푸어 개인전7년만의 국내전…3관 전부 내줘피·살점·내장 연상시키는 작품경이로움과 공포 동시에 표현선명한 黑·赤 폭발하는 듯한 회화'반타블랙' 사용한 조각들도 나와""색채·스케일 남다른 카푸어 작품실제 보면 사진보다 훨씬 압도적""Tongue.숭고한 것들은 때로는 보기에 불편하다. 출산도 그런 것 중 하나다. 그만큼 위대한 일은 없지만, 그 장면을 직접 보려면 마음의 준비가 필요하다. 뇌와 내장도 마찬가지다. 삶을 가능케 하는 경이로운 기관이지만 그 형상을 마주하는 건 그다지 유쾌한 경험이 아니다.인도 출신 영국 작가 아니쉬 카푸어(69·사진)는 이처럼 경이로움과 공포를 동시에 안겨주는 복잡한 느낌을 세상에서 가장 잘 표현하는 예술가 중 한 명이다. 일단 작가의 성품부터 평범하지 않다. 신기술로 개발한 물감(반타블랙)을 자기만 쓰겠다며 독점 이용권을 구입한 뒤 다른 사람은 못 쓰게 할 정도니…. 그에게 ‘예술가들이 가장 싫어하는 예술가’란 별명이 붙은 이유다.하지만 그를 싫어하는 작가조차 카푸어의 실력만큼은 인정한다. 카푸어가 ‘미술 올림픽’으로 불리는 베네치아비엔날레 신인상과 영국 최고 권위의 터너상을 석권하고 프랑스 베르사유궁전 등 세계적 명소를 전시장으로 쓸 수 있는 까닭이다.이런 카푸어의 작품을 한국에서 만날 수 있는 길이 열렸다. 서울 삼청동 국제갤러리가 3개 관을 털어 그가 만든 대형 조각과 드로잉 등 20여 점을 걸었다. 카푸어의 작품전이 국내에서 열리는 건 7년 만이다.작품들이 주는 인상은 그야말로 강렬하다. 첫 번째 전시장인 3관(K3)에선 중량 500㎏이 넘는 4점의 거대한 조각을 만날 수 있다. 운석과 바윗돌을 연상시키는 조각 위로 그물처럼 보이는 유리섬유가 덮여 있다. 피와 살점, 내장을 연상시키는 작업들이다.작가를 상징하는 작업은 2관(K2)에서 본격적으로 펼쳐진다. 강렬하고 선명한 검은색과 붉은색이 폭발하는 듯한 회화와 조각들이 전시돼 있다. 윤혜정 국제갤러리 디렉터는 “핏빛 색채를 통해 원초적인 생명력과 여성적인 창조의 힘을 표현한 것”이라며 “아름다움과 불편한 감정이 공존하는 상태가 담겨 있는 작품들”이라고 설명했다.낼름 내민 새빨간 혀를 표현한 ‘Tongue’이 특히 인상적이다. 인도 신화에 나오는 여신 ‘칼리’의 길게 늘어뜨린 혀에서 모티브를 따왔다. 칼리가 관장하는 분야가 파괴와 시간, 죽음, 변화라는 점이 카푸어의 주제의식과 일맥상통한다. 실리콘과 강화유리, 유화 물감을 사용한 대형 회화 신작들도 완성도 높다.1관(K1)에서는 상대적으로 무난한 드로잉 작품과 함께 카푸어를 상징하는 도료 ‘반타블랙’을 사용해 만든 조각들을 만날 수 있다. 반타블랙은 ‘세상에서 가장 검은 색깔’로 불리는 색으로, 거의 모든 빛(99.6%)을 흡수해 조각 모양을 완전히 지운다. 그 덕분에 옆에서 보면 입체적으로 튀어나온 모양도 정면에서는 그저 평면 도형으로 보이는 신기한 경험을 할 수 있다. 우주의 무한함과 블랙홀을 연상시키는 이 ‘검은 조각’들을 통해 카푸어는 ‘있으면서도 없는 느낌’을 표현했다.모든 미술 작품이 그렇지만, 특유의 색채와 스케일 덕분에 사진으로 볼 때와 직접 볼 때의 느낌이 완전히 다르다. 눈앞에서 보면 카푸어가 세계적인 명성을 얻은 것에 대해 고개를 끄덕이게 된다. 한 큐레이터는 “비슷한 주제를 표현한 다른 작가들의 전시를 보면 카푸어의 작품이 얼마나 완성도 높은지 알 수 있다”고 했다.국내 1위 화랑인 국제갤러리의 글로벌 네트워크와 큐레이션 실력을 보여주는 전시기도 하다. 오는 10월 22일까지 열린다. 시간당 관람 인원이 제한돼 있어 전시를 보려면 현장에서 기다려야 할 수도 있다.1~3관 옆에 있는 국제갤러리 한옥 공간의 ‘동면 한옥’도 들러볼 만한 전시다. 세계적인 명성을 쌓은 양혜규의 여러 조각과 설치 작품을 밀도 있게 감상할 수 있다. 전통 설화에서 영감을 받은 ‘소리나는 동아줄’과 무속 신앙에서 영감을 받은 ‘황홀두폭병-방언 충천 춘하 기수도’ 등 신작이 놓여 있다. 해가 진 뒤 조명이 꺼진 한옥 공간에서 손전등을 들고 작품의 이모저모를 살펴보는 특별한 경험을 할 수 있다. 10월 8일까지.",화,
86,한국경제,https://n.news.naver.com/mnews/article/015/0004887445,DDP 하늘에 오로라가?…디지털 기술로 창조한 자연의 신비,2023-09-05,"댄 아셔가 선보인 '인공 오로라'날씨 따라 다르게 보이는 매력'佛 미디어아트 거장' 슈발리에DDP 외벽 꽃·나무 디지털 전시오는 10일까지만 관람할 수 있어‘천사의 커튼’ ‘영혼의 샤워’ 등으로 불리는 오로라는 수많은 사람의 버킷 리스트에 오르는 이름이다. 눈에 넣고 싶을 만큼 아름다운데, 만나기가 너무 어렵다 보니 ‘죽기 전에 꼭 해야 할 일’ 목록의 단골메뉴가 됐다. 산 넘고 물 건너 북극 근처에 가도 흐린 날씨 때문에 허탕 치고 돌아오는 사람이 수두룩하다.이렇게 귀한 오로라가 4일 저녁 7시 서울 중구 동대문디자인플라자(DDP) 하늘을 수놓았다. 은은한 음악과 함께 초록색, 보라색 빛깔이 어우러지며 서울 하늘을 단숨에 북극 하늘로 바꿔놨다. 이뿐만 아니다. 저녁 8시부터는 222ｍ에 달하는 DDP의 거대한 서측 외벽이 꽃과 나무로 물들었다.댄 아셔국내 최대 아트페어인 ‘한국국제아트페어(KIAF)-프리즈 서울’ 기간을 맞아 DDP가 선보인 디지털 아트 작품들이다. 꽃과 나무를 디지털로 구현한 프랑스 출신 미디어아트 거장 미겔 슈발리에와 인공 오로라를 동대문 하늘에 띄운 스위스의 유명 설치미술가 댄 아셔를 최근 만났다.슈발리에는 한국경제신문과의 인터뷰에서 “DDP처럼 거대하고 멋진 건물을 활용해 작품을 선보이다니 내 꿈이 이뤄진 것 같다”고 말했다. “서울의 야외 건물을 배경으로 작품을 만들어보고 싶다”고 한 게 올 1월 서울 종로구 아라아트센터에서 개인전을 열 때였으니, 8개월 만에 소원을 이룬 것이다.미겔 슈발리에슈발리에는 프랑스의 ‘국가대표급’ 예술가다. 미디어아트가 예술로 인정받지 못한 1980년대부터 수준급 작품을 꾸준히 선보인 덕분에 문화예술훈장도 받았다. “다들 미쳤다고 했죠. 아날로그 시대에 ‘디지털 예술’을 한다고 했으니…. 하지만 그때도 관습에 얽매이지 않은 ‘깨어있는 예술가’들이 있었습니다. 백남준처럼요. 그 덕분에 저도 포기하지 않고 버틸 수 있었습니다.”슈발리에는 이번에 인공지능(AI)을 작품에 적용하는 새로운 시도를 했다. DDP 건물에서 피어오르는 꽃과 나무, 잎사귀 등은 모두 생성형 AI 프로그램이 창조해낸 그림이다. 작품 제목이 ‘메타-네이처 AI’인 이유다. 그는 “AI는 예술을 위협하는 괴물이 아닌 좋은 아이디어를 갖고 있는 예술가에겐 새로운 기회를 주는 도구”라고 했다.슈발리에가 DDP 외관을 배경으로 작품을 선보였다면 아셔는 도시 하늘을 캔버스로 삼았다. 그의 대표작은 전세계 38개 도시에서 선보인 인공 오로라 ‘보레알리스’다. 라틴어로 오로라가 있는 북쪽이란 뜻이다. 동대문 하늘을 수놓은 보레알리스는 그가 39번째로 만든 인공 오로라다.그는 보레알리스에 대해 “나는 상황만 디자인하고, 환경이 완성하는 작품”이라고 설명했다. 야외에서 연출하는 작품이라 온도, 습도, 풍속 등에 따라 오로라가 완전히 달라 보이기 때문이다. 그는 “사람 눈엔 보이지 않는 광선을 층층이 겹친 후 그 위에 안개를 뿌려 가시광선이 되도록 만든다”며 “바람이 너무 강하지 않고, 구름이 끼지 않은 맑은 날일수록 실제와 가까운 오로라를 즐길 수 있다”고 했다.보기에는 마냥 아름답지만 그 밑에는 진지한 고찰이 깔려 있다. 아셔는 “기술은 인류에 꼭 필요하지만 환경을 파괴하기도 한다”며 “인공 오로라를 있는 그대로 즐기는 것도 좋지만, 관객들이 ‘정말 기술이 자연을 대체할 수 있을까’ 생각해보는 계기가 됐으면 한다”고 말했다. 슈발리에 작품은 DDP 서측 앞면에서 저녁 8~10시, 아셔 작품은 잔디언덕에서 저녁 7~11시에 볼 수 있다. 두 작품 모두 KIAF-프리즈가 끝나는 10일까지만 만날 수 있다.",화,
