,Press,Url,Title,Date,Body,Weekday,Sentiment
56,한국경제,https://n.news.naver.com/mnews/article/015/0004887418,숨은 규제 찾아주고 맞춤 컨설팅…민·관 힘합쳐 기술장벽 넘는다,2023-09-05,"지난해 WTO 기술장벽 3896건…20년만에 10배 넘게 늘어국가기술표준원, 산단공 등과 기업 기술규제·인증 지원 협약종합지원센터·통합 플랫폼 통해 중견·중기 대응 총력 지원진종욱 산업통상자원부 국가기술표준원장(왼쪽 여섯 번째)과 이상훈 한국산업단지공단 이사장(다섯 번째)을 비롯해 7개 시험인증기관 관계자들이 지난달 31일 산단공 서울지역본부에서 수출 기업의 해외 기술 규제 문제 해결을 돕고자 업무협약을 체결하고 있다. 국가기술표준원 제공수출기업은 해외에서 생각하지도 못한 각종 규제에 직면한다. 기술규제도 그중 하나다. 해외에서 맞닥뜨린 기술 장벽은 기업 혼자선 풀기 힘든 난제이기도 하다. 한국산업단지공단 등 관련 기관들이 해외기술규제를 보다 빠르게 해결하기 위해 손을 잡았다.국가기술표준원과 산단공 및 7개 인증기관은 지난달 31일 산단공 서울지역본부에서 ‘지역밀착형 기술규제·인증 관련 기업지원을 위한 업무협약(MOU)’을 체결했다. 진종욱 산업통상자원부 국가기술표준원장은 이 자리에서 “배터리 재사용 의무 강화, 에너지효율 기준 상향 등 매년 급격히 증가하고 있는 해외 기술규제를 민·관이 힘을 합치고 총력을 기울여 더욱 신속히 해결하겠다”며 “한국 기업의 수출 활동에 차질이 없도록 할 것”이라고 강조했다. 대폭 증가한 기술규제MOU에 이어 디지털산업단지 입주기업 대상 정보기술(IT)·전기전자 분야 해외인증지원 설명회도 열렸다. 참석자들은 한목소리로 “기술규제는 기술과 품질 향상, 안전 확보에 기여하는 등의 장점도 있지만 국제표준과 다르거나 과도한 해외 기술규제는 무역기술장벽(TBT)으로 작용해 수출기업에 부담으로 작용한다”며 “한국 기업이 TBT를 뛰어넘어 기존 수출시장을 지키고 더 나아가 새로운 수출시장을 개척할 수 있도록 관련 시책을 보다 강력히 추진할 필요가 있다”고 호소했다.코로나19 확산과 러시아의 우크라이나 침공 등 영향으로 글로벌 공급망이 정상적으로 작동하지 않게 되자 각국은 보호무역주의 기조를 강화하고 있다. 여기에 자국 첨단산업 경쟁력 제고 차원의 표준, 기술기준, 시험·인증 등 기술규제를 TBT로 활용하고 있다.각국이 공식적으로 세계무역기구(WTO)에 통보한 기술규제는 지난해 3896건으로 1995년 389건에 비해 10배 이상 늘었다. WTO에 통보하지 않은 숨은 규제도 지난해 기준 약 700건을 웃도는 것으로 전해진다. 기업 실태조사 결과, 정부의 적극적 역할 요망해외 각국이 TBT와 관련해 주도면밀하게 움직이는 가운데 이를 국내 중견·중소기업이 개별적으로 대응하기는 어려운 상황이다. 국가기술표준원이 올해 수출 100대 및 중견·중소 300개를 대상으로 기업 해외 기술규제 애로 현황을 조사한 결과, 해외 기술규제 대응 전담부서를 보유한 기업 비율은 43%에 불과했다. 대기업(62.5%), 중견기업(43.1%), 중소기업(39.5%)으로 기업 규모가 작을수록 전담부서 보유 비율이 낮은 것으로 조사됐다.특히 최근 5년간 해외 기술규제 때문에 수출 애로를 겪은 기업은 26.2%에 달했다. 해당 기업 중 17.9%는 수출·입을 포기한 경험이 있다고 밝혔다. 이 기업들은 “숨은 규제나 개발도상국의 규제, 불합리한 규제와 관련해 해외 규제당국을 기업 자체적으로 대응하기에는 한계가 있다”며 “해외 기술규제로 인한 애로를 해소하기 위해 정부 지원이 필수”라고 강조했다. 해외 기술규제, 신속하게 해결한다국가기술표준원은 WTO TBT 관련 국내 공식 질의처다. 해외 기술규제의 전 주기에 걸쳐 TBT 대응 총괄기관으로 기업을 지원하고 있다. 국내 기업이 제·개정되는 해외 기술규제에 발 빠르게 대응할 수 있도록 정보수집과 분석전파 역량을 강화하고 있다. 해외 기술규제 정보 제공부터 TBT 애로 접수·해소까지 한 번에 제공하기 위해 2021년 1월 TBT 지원 전담 기관인 TBT 종합지원센터를 설치했다.TBT종합지원센터는 지난해 WTO TBT 위원회를 통해 통보된 규제와 통보되지 않은 숨은 규제를 전문기관과 분석해 4000여 건을 기업에 전했다. 정보력이 취약한 중견·중소기업에 대해 300여 건의 컨설팅도 시행했다.또 국가기술표준원은 2008년부터 운영 중인 ‘노우TBT(KnowTBT) 포털’을 해외 기술규제 정보 통합 플랫폼인 ‘지능형 해외 기술규제 대응 정보시스템’으로 지난 2월 전면 개편했다. 해외 기술규제 제·개정 정보를 국가별·품목별로 수요 기업에 매칭해 주는 맞춤형 정보 제공과 24시간 챗봇상담 서비스를 시행하고 있다. 주요 수출 20개국의 주력 수출 품목에 대한 240여 개 인증제도와 2986개 기술기준을 한눈에 볼 수 있다.이번 MOU를 통해 산단공은 ‘해외인증기관 지원협의체’에 합류해 산단공 입주기업의 해외인증을 비롯한 기업애로 발굴·접수를 위한 상시 창구를 제공한다. 국가기술표준원 및 시험인증기관과 협력해 지역 산단별 특화된 산업 분야 맞춤형 기술규제 설명회 및 간담회, 교육 등을 개최할 예정이다.진 원장은 “수출기업의 해외 규제 애로를 적기에 해소할 수 있는 여건을 마련하는 것이 기업지원의 첫걸음”이라며 “전국 66개의 국가산업단지 네트워크를 활용해 지역밀착형 해외 기술규제 기업지원 체계를 구축하는 데 적극 노력하겠다”고 밝혔다.",화,
57,한국경제,https://n.news.naver.com/mnews/article/015/0004887468,삼성·포스코 올라타고 '들썩'…장중 신고가 또 뚫었다,2023-09-05,"포스코와 손잡은 대동 상한가삼성과 협력 레인보우 장중 신고가한화 진출 '협동로봇' 뉴로메카 강세 대기업과 협업 부각 로봇주 급등에스비비 32%·에스피지 23%↑ 'KODEX K로봇' 6개월 상승률 22%로봇 관련주 주가가 들썩이고 있다. 삼성, 한화, 포스코 등 대기업이 로봇 사업을 확대거나 생산 과정에 로봇을 도입하겠다고 속속 발표한 것이 호재가 됐다. 기업들이 인건비 절약, 정확성 확보 등에 나서면서 국내 로봇산업이 본격 성장할 것이란 기대도 크다. 대기업과의 협업에 로봇주 급등4일 농기계 회사인 대동은 유가증권시장에서 가격제한폭(29.93%)까지 치솟으며 1만3980원에 마감했다. 52주 최고가를 다시 썼다. 이날 대동이 포스코 공정연구소와 ‘로봇 관련 업무협약(MOU)’을 맺은 게 호재로 작용했다. 대동은 내년까지 포스코 제철소의 낙광 및 폐기물을 제거하기 위해 리모컨으로 원격 조종하는 ‘임무 로봇’을 개발하기로 했다.이날 로봇용 감속기 회사인 에스비비테크(23.38%), 에스피지(14.86%), 우림피티에스(8.62%)도 삼성, 두산 등 대기업과의 협업이 부각되면서 주가가 급등했다. 에스비비테크는 두산로보틱스 등과 정밀 감속기 양산을 논의하는 것으로 알려졌다. 에스피지는 삼성전자와 LG전자, 국내 대표 로봇 개발회사인 레인보우로보틱스에 감속기를 납품하고 있다. 우림피티에스는 삼성중공업과 국책과제 공동 개발을 진행했다. 이들을 포함해 이날 로봇 업종에 속하는 32개 종목 중 29곳이 상승 마감했다.로봇 테마주 강세는 지난주부터 시작됐다. 지난달 31일 삼성전자가 인공지능(AI)을 적용한 휴머노이드 로봇을 반도체 생산공정에 투입하는 방안을 검토 중이라고 발표하자 레인보우로보틱스 주가가 같은 날 24.59%, 지난 1일 7.46% 급등했다. 레인보우로보틱스는 이날 0.18% 하락했지만 장중 17만3200원까지 오르며 52주 신고가를 경신했다. 레인보우로보틱스는 올 1월 삼성전자가 유상증자에 참여해 지분 14.99%를 확보한 업체다. 국내 로봇기업, 경쟁력 높아져한화그룹이 지난달 31일 협동로봇 사업에 뛰어든다고 발표한 것도 일부 로봇 관련주 주가를 끌어올렸다. 한화그룹이 중점을 둔 푸드테크(음식 자동화) 로봇을 제작하는 뉴로메카는 발표 당일 주가가 18.89% 상승했다.로봇주를 담은 상장지수펀드(ETF)도 상승세를 나타내고 있다. 삼성자산운용의 ‘KODEX K-로봇 액티브 ETF’는 최근 6개월간 21.9% 올랐다. 레인보우로보틱스(비중 8.33%), 티로보틱스(6.29%) 등을 담고 있다.전문가들은 로봇 관련주 강세가 당분간 이어질 것으로 전망했다. 대기업이 진출하면서 협동로봇을 중심으로 국내 로봇 시장 규모가 점차 커질 것으로 예상된다는 설명이다. 두산로보틱스가 이달 상장(IPO)을 추진하는 것도 로봇 관련주에 대한 관심을 높일 것으로 전망된다. 최종경 흥국증권 연구원은 “감속기, 제어기, 서브모터 등 협동로봇 핵심 6개 필요 부품을 최근 몇 년 사이 국내 기업이 모두 국산화했다”며 “최근 주가 상승은 국내 로봇 관련 기업들의 해외 경쟁력이 높아지고 있다는 점을 의미한다”고 말했다.",화,
58,한국경제,https://n.news.naver.com/mnews/article/015/0004887475,"'홀로 뒤처진' 현대미포조선, 조선주 랠리 합류하나",2023-09-05,"석유화학제품 운반선 수주 증가7거래일간 7.7%↑…목표가 상향올해 ‘조선주 랠리’에서 소외됐던 현대미포조선에 대한 관심이 커지고 있다. 현대미포조선의 주력 선종인 석유화학제품 운반선(PC선)의 업황이 개선되고 있어서다.현대미포조선은 4일 유가증권시장에서 0.79% 오른 8만9100원에 마감했다. 최근 7거래일간 7.74% 상승했다. 이런 반등에도 불구하고 올해 기준 현대미포조선의 상승률은 경쟁사에 비해 뒤처진다.올 들어 HD한국조선해양(72.6%)을 비롯해 한화오션(90.5%), 삼성중공업(65.8%) 등 조선주는 일제히 급등했다. 같은 기간 현대미포조선은 고작 5.4% 오르는 데 그쳤다.이런 주가 흐름은 최근 2~3년간 액화천연가스(LNG) 운반선을 중심으로 한 고부가가치 대형선박 위주의 신조선 발주 때문인 것으로 분석됐다. 현대미포조선은 가격대가 낮은 중형선박을 주로 수주한다. 이 회사는 지난 2분기 525억원의 영업적자를 냈다.하반기부터는 이런 상황이 달라질 것이란 전망이 나온다. PC선 중심으로 수주가 잇따르고 있어서다. 현대미포조선은 상반기 24억5000만달러어치를 수주해 연간 수주 목표 37억달러의 66%를 채웠다. 수주 선박 46척 중 36척이 PC선이다. PC선의 신조선가(새로 건조한 선박 가격)도 지난해에 비해 8~10% 올랐다.엄경아 신영증권 연구원은 “수주모멘텀이 대형조선소보다 좋아지고 있다”며 “오일탱커, 케미컬탱커, 액화석유가스(LPG) 운반선 등의 수주량이 증가하고 있다”고 말했다.안유동 교보증권 연구원은 “인력난에 따른 일회성 비용과 생산 차질도 3분기부터 발생하지 않을 것으로 예상된다”며 목표주가를 10만1000원에서 12만7000원으로 올려 잡았다.",화,
59,한국경제,https://n.news.naver.com/mnews/article/015/0004887477,어느새 배당률 10%…은행·보험주에 돈 몰리네,2023-09-05,"테마장세 피로…안정 투자처 눈길외국인·기관 매수세 몰려실적개선에 저평가 매력도하반기 들어 박스권과 테마 장세가 이어지면서 은행·보험주 같은 금융 배당주에 눈을 돌리는 투자자가 늘어나고 있다.우리금융지주는 4일 0.25% 오른 1만1900원에 거래를 마쳤다. 지난달 16일 이후 보름 동안 우상향하면서 주가가 5.12% 뛰었다. 같은 기간 KB금융은 5.9%, 신한금융도 3.33% 올랐다.통상 은행주 같은 고배당주는 연말이 다가오면 배당 수익에 대한 기대로 주가가 오른다. 올해는 상반기 일부 업종의 주가가 큰 폭으로 올라 차익 실현 수요가 큰 상황에서 테마주 등으로 인한 변동성 장세가 지속되자 투자 타이밍이 예년보다 빨라졌다는 분석이다. 여기에 올해 실적 대비 주가 수준도 매력적이라는 평가다. 이날 기준 우리금융의 시가배당률은 9%가 넘는다.거래는 외국인과 기관이 주도하고 있다. 외국인 투자자는 지난달 22일부터 이날까지 2주일 동안 은행주를 879억원어치 순매수했다. 국내 기관투자가도 같은 기간 은행주를 764억원어치 샀다. 이 기간 유가증권시장에서 외국인은 1470억원어치 팔았고, 기관은 5390억원어치 샀다.최정욱 하나증권 연구원은 “외국인이 주간 단위로 국내 은행주를 500억원 이상 순매수한 것은 이례적”이라며 “수급 변화에 주목해야 하는 시점”이라고 말했다.보험업종 주가도 최근 오름세를 이어가고 있다. KRX보험업 지수는 지난 8월 한 달간 1.77% 상승했다. 같은 기간 코스피지수는 4% 정도 조정받았다. 보험업종은 특히 회계기준(IFRS9·IFRS17) 변경으로 업종 대표주들의 실적이 개선되고 있는 게 주가에 영향을 미쳤다.금융감독원에 따르면 올해 상반기 국내 생명·손해보험사의 당기순이익은 총 9조1440억원으로 지난해 같은 기간보다 63.2% 증가했다. 증권가는 배당수익률이 상대적으로 높은 한화생명과 삼성생명을 선호주로 추천했다.정준섭 NH투자증권 애널리스트는 “보험주의 가장 큰 투자포인트는 고배당 수익”이라며 “한화생명은 올해 12.9%의 배당수익이 가능할 것”이라고 내다봤다.",화,
60,한국경제,https://n.news.naver.com/mnews/article/015/0004887478,美서 전력변압기 '불티'…효성중공업·제룡전기 '후끈',2023-09-05,"신재생에너지 발전소 수요↑올들어 주가 두 배 넘게 뛰어효성중공업, LS일렉트릭 등 전력 변압기를 생산하는 기업의 질주가 이어지고 있다. 최근 주가 급등에도 증권사들은 여전히 저평가돼 있다며 긍정적 투자 의견을 내놓고 있다. 해외 수요가 공급보다 빠르게 늘어나면서 당분간 실적 성장이 계속될 것이란 전망이 나온다.4일 한국거래소에 따르면 효성중공업은 올 들어 152.09% 올랐다. 최근 한 달 사이에도 7.21% 뛰었다. 효성중공업은 대형 발전소가 생산한 전기를 실제 사용할 수 있도록 전압을 바꿔주는 초고압 변압기를 생산하는 회사다. 가파른 주가 상승은 실적이 뒷받침하고 있다. 효성중공업은 2021년 영업이익이 1201억원이었지만, 지난해 1432억원으로 증가했다. 올해는 2778억원으로 전년 대비 약 두 배로 늘어날 것으로 예상된다.초고압 변압기를 생산하는 LS일렉트릭과 HD현대일렉트릭도 올 들어 주가가 각각 70.6%, 59.95% 올랐다. LS 일렉트릭의 영업이익은 올해 전년 대비 90.57%, HD현대일렉트릭은 86.85% 늘어날 것으로 예상된다.중소변압기를 생산하는 기업의 주가도 실적을 바탕으로 가파르게 오르고 있다. 제룡전기는 올해만 145.75% 뛰었다. 일진전기도 128.99% 상승했다. 비상장 기업 산일전기는 실적을 앞세워 유가증권시장 상장을 추진하고 있다.변압기를 생산하는 업체들의 실적이 가파르게 개선된 까닭은 미국 등을 중심으로 해외 수요가 가파르게 늘어나고 있어서다. 태양광, 풍력 등 신재생에너지 발전소가 인플레이션 감축법(IRA) 시행과 함께 급격히 증가하면서 여기에 필요한 변압기 수요가 늘고 있다.전력망 교체 주기가 도래했다는 분석도 나온다. 전력기기의 수명은 일반적으로 30년이다. 미국 에너지부에 따르면 미 전 지역 변압기 중 약 70%가 25년 이상인 것으로 조사됐다.",화,
61,한국경제,https://n.news.naver.com/mnews/article/015/0004887415,미아9-2구역 1758가구 재건축,2023-09-05,"사업시행계획 인가 획득최고 25층…용적률 227%서울 강북구 미아9-2구역이 사업시행계획 인가를 받아 착공까지 마지막 인허가 단계인 관리처분계획만 남겨두게 됐다. 향후 지상 25층, 1758가구의 대단지로 거듭난다.강북구는 미아9-2구역(미아동 137의72 일대) 주택재건축정비사업(조감도) 사업시행계획을 인가했다고 4일 밝혔다. 사업시행계획에 따르면 대지 10만2371㎡에 지하 6층~지상 25층, 22개 동, 1758가구(전용 52~157㎡)의 아파트가 들어서게 된다. 이 구역의 건폐율과 용적률은 각각 20.77%, 227.33%가 적용됐다.이 구역은 2006년 조합설립추진위원회 승인을 받아 재개발이 17년째 추진되고 있는 곳이다. 뇌물수수 등의 혐의로 검찰 기소된 조합장을 지난 7월 교체하면서 재개발에 속도를 내고 있다.단지는 지하철 4호선 미아사거리역 반경 500m로 가까운 편이다. 송중초가 남쪽으로 접해 있다. 동쪽으로 북서울꿈의숲이 있다.아파트 남쪽엔 7509㎡ 규모의 공원이 조성된다. 공공공지 및 부대 복리시설도 들어서 인근 주민의 편의성도 높아질 것으로 기대된다. 사업구역 중 2291㎡는 송중초로 편입된다. 미아9-2구역은 시공사 선정에 나설 예정이다. 이순희 강북구청장은 “사업시행계획 인가라는 큰 문턱을 넘은 만큼 앞으로도 노후 주거지의 계획적 정비를 유도하겠다”며 “양질의 주택을 공급할 수 있도록 지원을 아끼지 않겠다”고 말했다.",화,
62,한국경제,https://n.news.naver.com/mnews/article/015/0004887413,"영업정지 취하·중지 158건…건설업계 ""억울한 사례 많아""",2023-09-05,"올 27건…작년 전체 건수 육박정부 행정처분 강화 기조에업계 ""현장 상황과 많이 달라""부실시공 논란과 정부의 처벌 강화로 영업정지 처분을 받는 건설회사가 늘고 있다. 하지만 처분이 취하되거나 법원 판단으로 중지된 사례가 덩달아 증가하고 있는 것으로 나타났다. 건설업계는 “정부의 행정처분 강화 기조가 현장 상황과 맞지 않는 경우가 잦다”며 억울한 사례가 많다는 입장이다.4일 건설업계와 건설산업지식정보시스템 등에 따르면 2020년부터 지난달까지 전국 지방자치단체가 앞서 내렸던 종합건설사 영업정지 처분을 취하하거나 법원이 중지한 사례는 158건에 달했다. 2020년과 2021년 각각 56, 54건이던 취하·중지 사례는 지난해 31건으로 줄었다. 그러나 올해 들어 지난달까지 27건으로 다시 증가하며 지난해 전체 건수에 육박하고 있다.경상북도는 지난달 2021년 한 대형건설사에 내린 영업정지 처분을 취하했다. 2년여 소송 끝에 현장 사고에 건설사의 과실이 없다는 판결이 확정되자 조정을 통해 처분을 철회했다. 인천시 역시 같은 달 한양에 내린 영업정지 처분을 철회했다. 영업정지처분 취소 소송이 건설사 승소로 끝난 데 따른 조치였다. 다른 대형 건설사의 경우 영업정지 처분을 두고 법원에서 집행 정지 가처분 결정을 받아 소송을 이어가고 있는 사례만 4건에 달한다.일반적으로 건설사에 대한 영업정지는 중대재해 사고 등이 발생했을 때 정부가 지자체에 요청해 이뤄진다. 그러나 소송이 장기화하거나 취하하는 사례가 많아 지자체와 건설업계 모두 불만이 크다. 한 광역지자체 소송 관계자는 “지자체로서도 소송이 수년씩 장기화하면 비용 부담이 적지 않다”며 “처분 대상이 확대되는 것에 대한 부작용도 생각해야 한다”고 했다.건설업계도 영업정지 처분 기준이 건설사에 가혹하다는 입장이다. 특히 최근 사고에 책임이 없는 공동도급사에까지 영업정지 처분을 함께 내리는 사례가 많아 소송 부담이 늘었다는 설명이다. 건설사 관계자는 “건설사의 책임이 입증되지 않았음에도 처분이 내려지는 경우가 다반사”라며 “그사이 소비자 신뢰 하락 등의 부작용은 회사가 혼자 감내해야 한다”고 했다.업계에서는 소송을 통해 해결해야만 하는 영업정지 처분 관행에 문제가 있다고 지적이다. 업계 관계자는 “최근 외국인 근로자의 현장 안전 수칙 위반에도 영업정지 처분이 내려지는 사례가 늘고 있다”고 말했다.",화,
63,한국경제,https://n.news.naver.com/mnews/article/015/0004887412,부동산도 '아트 마케팅'…일레븐건설 'KIAF' 파트너사로,2023-09-05,"부동산 프리즘 업계 최초로 '아트페어' 참여행사장에 주상복합 부스 마련13兆 대형 복합개발 사업 홍보개발업체(디벨로퍼) 일레븐건설이 부동산업계 최초로 아트페어 공식 파트너로 참여한다. 서울 용산 유엔사 부지에 선보이는 최고급 주상복합 아파트 ‘더파크사이드 서울’(투시도) 부스를 아트페어에 마련해 ‘아트슈머’(소비를 통해 문화적 만족감을 충족하는 성향)의 라이프 스타일에 맞춘 홍보에 나선다는 설명이다.일레븐건설은 한국 대표 아트페어인 ‘한국국제아트페어(KIAF)’ 공식 파트너로 참여한다고 4일 밝혔다. 주로 대형 금융회사, 백화점, 호텔 등의 대기업이 후원사로 참여하는 아트페어에 부동산 시행사가 참여하는 건 이례적이라는 평가다.KIAF는 한국화랑협회가 2002년 설립해 올해 22년째를 맞고 있는 국내 최초 아트페어다. 올해 20개국, 211개 갤러리가 참가할 예정이다. 작년 세계 3대 아트페어로 불리는 ‘프리즈 서울’과 처음으로 공동 아트페어를 열어 9만여 명이 방문하는 등 미술 시장을 들썩이게 했다.일레븐건설은 KIAF 행사장 내 더파크사이드 서울 홍보부스를 마련할 계획이다. 아트슈머의 라이프 스타일에 맞는 더파크사이드 서울만의 차별화된 철학을 전달한다는 설명이다.더파크사이드 서울은 강북의 ‘노른자위 땅’으로 꼽히는 용산구 이태원동 유엔사 부지에 들어선다. 지하 7층~지상 20층, 11개 동에 공동주택(420가구), 오피스텔(723실), 호텔, 오피스, 상업시설 등이 들어서는 13조원 규모의 대형 복합개발 사업이다. 시공은 현대건설이 맡는다. 다음달 오피스텔 ‘더파크사이드 스위트’를 더파크사이드 서울 갤러리에서 먼저 선보인다.더파크사이드 서울에는 세계적 럭셔리 라이프 스타일 호텔인 로즈우드 서울이 들어온다. 오피스텔 입주민을 위한 식음 및 피트니스 서비스 등을 제공할 예정이다.일레븐건설 관계자는 “더파크사이드 서울은 규모, 자재, 외관 등 눈에 보이는 품질뿐만 아니라 기존에 경험할 수 없던 특별한 서비스와 문화·예술적 체험 등이 결합한 차별화된 공간”이라며 “KIAF 서울 행사에 방문하는 고객의 주거관과 라이프 스타일에 부합하는 주거상품”이라고 말했다. 이어 “이번 아트페어를 통해 예술산업 진흥을 후원하고 더파크사이드 서울만의 핵심 철학을 전달할 것”이라고 강조했다.",화,
64,한국경제,https://n.news.naver.com/mnews/article/015/0004887414,전국 '기업혁신파크' 선도사업 공모,2023-09-05,"기업·지차체가 개발 주도정부 ""稅지원·임대료 감면""정부가 민간 기업과 지방자치단체에서 주도해 지역 거점을 조성하는 ‘기업혁신파크 선도사업’ 공모에 나선다. 기존 기업도시 사업의 단점을 보완해 기업과 지자체에 대한 규제 완화와 지원을 확대한 새 제도다.국토교통부는 5일부터 기업혁신파크 선도사업 공모를 공고하고 지자체 공모 설명회를 연다고 4일 밝혔다. 사업 시작부터 기업과 지자체의 수요를 반영해 기업이 원하는 개발·투자가 가능하도록 지원할 예정이다.선도사업에 선정되면 시행자와 입주기업에 법인세 및 재산·취득세 지원이 이뤄진다. 임대료를 감면하고 토지수용권 같은 인센티브도 제공한다. 신설·창업 기업은 3년간 법인세가 면제된다.국토부는 최소면적 기준을 50만㎡로 축소하고 10만㎡ 이상 도시지역 소규모 개발도 허용한다. 선정 사업지엔 입지규제최소구역이 도입된다. 국토부는 연내 선도사업을 선정하고, 전문기관에 타당성 검토를 의뢰해 사업컨설팅을 지원한다는 계획이다.",화,
